{
    "$schema": "http://json-schema.org/schema#",
    "type": "object",
    "properties": {
        "$schema": {
            "type": "string"
        },
        "personalInfo": {
            "$ref": "#/definitions/personalInfo"
        },
        "highlights": {
            "type": "array",
            "items": {
                "type":"string"
            },
            "default": []
        },
        "skills": {
            "type":"array",
            "items":{"$ref": "#/definitions/skillItem"},
            "default": []
        },
        "work": {
            "type":"array",
            "items":{"$ref": "#/definitions/workItem"},
            "default": []
        },
        "projects": {
            "type":"array",
            "items":{"$ref": "#/definitions/projectItem"},
            "default": []
        }
    },
    "additionalProperties": false,
    "definitions": {
        "personalInfo": {
            "type": "object",
            "properties": {
                "name": {
                    "type": "string"
                },
                "email": {
                    "type": "string"
                },
                "location": {
                    "type": "string"
                }
            }
        },
        "skillItem": {
            "type": "object",
            "properties": {
                "category": {
                    "type": "string"
                },
                "skills": {
                    "type": "array",
                    "items": {
                        "type": "string"
                    }
                }
            }
        },
        "workItem": {
            "type": "object",
            "properties": {
                "employer": {
                    "type": "string"
                },
                "position":{
                    "type": "string"
                },
                "location":{
                    "type": "string"
                },
                "startDate": {
                    "type": "string"
                },
                "endDate": {
                    "type": "string"
                },
                "highlights":{
                    "type":"array",
                    "items": {"type":"string"}
                }
            }   
        },
        "projectItem":{
            "type": "object",
            "properties": {
                "name":{"type":"string"},
                "employer":{"type":"string"},
                "dateRange":{"type":"string"},
                "technologies":{
                    "type": "array",
                    "items": {"type":"string"}
                },
                "role":{"type":"string"},
                "teamSize":{"type":"number"},
                "responsibilities":{"type":"string"},
                "description":{"type":"string"}
            }
        }
    }
}